{
  "slug": "best-ai-writing-tools-for-content-creators-in-2026",
  "title": "Best AI writing tools for content creators in 2026: Complete Guide 2026",
  "meta_description": "Discover everything you need to know about best ai writing tools for content creators in 2026 in this comprehensive guide. Expert insights, practical tips, and real-world examples included here for you.",
  "content_markdown": "# Best AI writing tools for content creators in 2026: Complete Guide 2026\n\n**Meta description:** Discover everything you need to know about best ai writing tools for content creators in 2026 in this comprehensive guide. Expert insights, practical tips, and real-world examples included here for you.\n\n## Introduction\n[3-5 lines maximum. Hook the reader, state the problem, preview the solution.]\n\nThis is a demonstration article about Best AI writing tools for content creators in 2026. In this comprehensive guide, we'll explore the key aspects, best practices, and actionable insights. This content is generated in demo mode for testing purposes.\n\n## Table of Contents\n[Auto-generated list of all H2 sections below]\n\n## Understanding the Basics\n[Informative content with H3 subsections if needed]\n\nWhen it comes to best ai writing tools for content creators in 2026, understanding the fundamentals is crucial. Here are the core concepts:\n\n- **Definition**: What exactly is best ai writing tools for content creators in 2026 and why it matters\n- **Key Components**: The essential elements you need to know\n- **Historical Context**: How we got here and where we're going\n\n### Core Principles\n\nThe foundation of best ai writing tools for content creators in 2026 rests on several key principles:\n\n1. **Principle 1**: Quality over quantity - focus on what matters\n2. **Principle 2**: Consistency is key - maintain regular practices\n3. **Principle 3**: Adapt and evolve - stay current with trends\n\n## Key Considerations\n[Informative content with H3 subsections if needed]\n\nBefore diving deeper into best ai writing tools for content creators in 2026, consider these important factors:\n\n### Budget Considerations\n\n- **Entry Level**: $0-100/month (getting started)\n- **Mid-Range**: $100-500/month (established users)\n- **Enterprise**: $500+/month (advanced implementations)\n\n### Time Investment\n\nExpect to invest approximately:\n- Setup: 2-4 hours\n- Learning curve: 1-2 weeks\n- Ongoing maintenance: 2-4 hours/week\n\n### Technical Requirements\n\n- No special technical skills required\n- Basic understanding helpful\n- Support resources available\n\n## Best Practices and Strategies\n[Informative content with H3 subsections if needed]\n\nHere are proven strategies for success with best ai writing tools for content creators in 2026:\n\n### Strategy 1: Start Small, Scale Smart\n\nBegin with the basics and gradually expand. This approach minimizes risk while maximizing learning.\n\n**Key Actions:**\n- Set clear, measurable goals\n- Track progress consistently\n- Adjust based on results\n\n### Strategy 2: Focus on Quality\n\nQuality always trumps quantity. Better to do fewer things well than many things poorly.\n\n### Strategy 3: Learn from Others\n\nStudy successful case studies and adapt proven methods to your context.\n\n## Common Pitfalls to Avoid\n[Informative content with H3 subsections if needed]\n\nAvoid these common mistakes when working with best ai writing tools for content creators in 2026:\n\n- ❌ **Rushing the process** - Take time to plan properly\n- ❌ **Ignoring best practices** - Follow established guidelines\n- ❌ **Neglecting maintenance** - Regular upkeep is essential\n- ❌ **Overlooking details** - Small things make big differences\n- ❌ **Failing to measure** - Track your results consistently\n\n## Implementation Guide\n[Informative content with H3 subsections if needed]\n\nReady to implement best ai writing tools for content creators in 2026? Follow this step-by-step guide:\n\n### Step 1: Planning Phase\n\nDefine your objectives, timeline, and success metrics.\n\n### Step 2: Setup and Configuration\n\nGather necessary resources and configure your environment.\n\n### Step 3: Initial Implementation\n\nStart with a pilot or small-scale implementation.\n\n### Step 4: Testing and Refinement\n\nTest thoroughly and refine based on feedback.\n\n### Step 5: Full Rollout\n\nScale up to full implementation once validated.\n\n## FAQ\n\n**Q: How long does it take to see results with best ai writing tools for content creators in 2026?**\nA: Most users see initial results within 2-4 weeks, with significant improvements after 2-3 months of consistent application.\n\n**Q: What is the typical cost involved?**\nA: Costs vary widely depending on scale, ranging from free entry-level options to $500+/month for enterprise solutions.\n\n**Q: Do I need special technical skills?**\nA: No special technical skills are required. Basic computer literacy and willingness to learn are sufficient for most applications.\n\n**Q: Can this work for small businesses?**\nA: Absolutely! Many solutions are specifically designed for small business needs with scaled pricing and features.\n\n**Q: What are the most common mistakes to avoid?**\nA: The most common mistakes are rushing the implementation, neglecting planning, and failing to track results consistently.\n\n**Q: Is there a free trial available?**\nA: Many providers offer free trials or free tiers. Check specific provider offerings for details.\n\n**Q: How often should I review and update my approach?**\nA: Review monthly and make adjustments as needed. Quarterly deep reviews are recommended for strategy refinement.\n\n## Key Takeaways\n\n- Understanding fundamentals is crucial before implementation\n- Start small and scale based on validated results\n- Quality and consistency matter more than speed\n- Avoid common pitfalls by learning from others\n- Regular measurement and adjustment are essential\n- Budget varies widely based on needs and scale\n- Technical barriers are minimal for most users\n\n## Sources\n\n1. [Industry Standards Guide](https://example.com/standards-2026) — Comprehensive overview of current best practices\n2. [Research Report 2026](https://example.com/research-report) — Latest data and trends analysis\n3. [Expert Insights Database](https://example.com/expert-insights) — Curated expert opinions and case studies\n\n---\n\n**About the Author**\n\n**Demo Expert** — Content Generation Specialist\n\nDemo Expert is a fictional expert created for testing purposes. This bio demonstrates proper formatting and structure for author sections in generated articles.\n\n**Methodology:**\n- Mock generation for testing purposes\n- Structural validation and compliance checking\n- Fast execution without API costs\n",
  "faq": [
    {
      "q": "How long does it take to see results with best ai writing tools for content creators in 2026?",
      "a": "Most users see initial results within 2-4 weeks, with significant improvements after 2-3 months of consistent application."
    },
    {
      "q": "What is the typical cost involved?",
      "a": "Costs vary widely depending on scale, ranging from free entry-level options to $500+/month for enterprise solutions."
    },
    {
      "q": "Do I need special technical skills?",
      "a": "No special technical skills are required. Basic computer literacy and willingness to learn are sufficient for most applications."
    },
    {
      "q": "Can this work for small businesses?",
      "a": "Absolutely! Many solutions are specifically designed for small business needs with scaled pricing and features."
    },
    {
      "q": "What are the most common mistakes to avoid?",
      "a": "The most common mistakes are rushing the implementation, neglecting planning, and failing to track results consistently."
    },
    {
      "q": "Is there a free trial available?",
      "a": "Many providers offer free trials or free tiers. Check specific provider offerings for details."
    },
    {
      "q": "How often should I review and update my approach?",
      "a": "Review monthly and make adjustments as needed. Quarterly deep reviews are recommended for strategy refinement."
    }
  ],
  "sources": [
    "https://example.com/standards-2026",
    "https://example.com/research-report",
    "https://example.com/expert-insights"
  ],
  "author": {
    "name": "Demo Expert",
    "bio": "Content Generation Specialist Demo Expert is a fictional expert created for testing purposes. This bio demonstrates proper formatting and structure for author sections in generated articles.",
    "methodology": []
  },
  "score": {
    "total": 89,
    "details": {
      "structure": 19,
      "readability": 18,
      "sources": 12,
      "llm_friendliness": 20,
      "duplication": 20
    },
    "warnings": [
      "Meta description too long (202 chars, max ~160)",
      "Sources: low domain diversity (1 unique domains for 3 sources)"
    ]
  },
  "language": "en",
  "tone": "friendly",
  "generated_at": "2026-02-12T07:03:30.088566+00:00"
}